{
  "schemaVersion": 1,
  "family": "battleVariants",
  "category": "supplementaryAuthoritative",
  "expectedCount": 7,
  "entries": [
    {
      "slotId": "battleVariants:001",
      "authorityLabel": "Standardkampf",
      "authorityId": null,
      "subtype": null,
      "sourceLocator": {
        "file": "inputs/sources/GDD_V5_PHASE10_AUTHORITY_EXTRACT.md",
        "chapter": "17.1",
        "lineStart": 973,
        "lineEnd": 973,
        "lineSha256": "b9b321f21715fb3234ccb76845978c7ad2f7c178e6866e0e11b98aa7d2bf1d33"
      },
      "runtimeId": null,
      "status": "UNEXTRACTED",
      "extractor": null,
      "extractedAt": null,
      "sourceOutputPath": null,
      "review": {
        "reviewer": null,
        "reviewedAt": null,
        "verdict": "PENDING",
        "defectIds": []
      },
      "fidelity": {
        "numericFacts": null,
        "textFactsSha256": null,
        "secondsConversion": "CENTRAL_COMPILER_ONLY"
      },
      "localization": {
        "deKey": null,
        "enKey": null,
        "enStatus": "NOT_STARTED"
      },
      "assetRequirements": []
    },
    {
      "slotId": "battleVariants:002",
      "authorityLabel": "Hinterhalt",
      "authorityId": null,
      "subtype": null,
      "sourceLocator": {
        "file": "inputs/sources/GDD_V5_PHASE10_AUTHORITY_EXTRACT.md",
        "chapter": "17.1",
        "lineStart": 974,
        "lineEnd": 974,
        "lineSha256": "d2bb549f68bf5f4502e3269305a592970ae3c535129b84e85460298f2120f399"
      },
      "runtimeId": null,
      "status": "UNEXTRACTED",
      "extractor": null,
      "extractedAt": null,
      "sourceOutputPath": null,
      "review": {
        "reviewer": null,
        "reviewedAt": null,
        "verdict": "PENDING",
        "defectIds": []
      },
      "fidelity": {
        "numericFacts": null,
        "textFactsSha256": null,
        "secondsConversion": "CENTRAL_COMPILER_ONLY"
      },
      "localization": {
        "deKey": null,
        "enKey": null,
        "enStatus": "NOT_STARTED"
      },
      "assetRequirements": []
    },
    {
      "slotId": "battleVariants:003",
      "authorityLabel": "Befestigte Stellung",
      "authorityId": null,
      "subtype": null,
      "sourceLocator": {
        "file": "inputs/sources/GDD_V5_PHASE10_AUTHORITY_EXTRACT.md",
        "chapter": "17.1",
        "lineStart": 975,
        "lineEnd": 975,
        "lineSha256": "96edc013ff97069037ae4714b88cd53c77a47013f96db9bab036d3b84e5d3747"
      },
      "runtimeId": null,
      "status": "UNEXTRACTED",
      "extractor": null,
      "extractedAt": null,
      "sourceOutputPath": null,
      "review": {
        "reviewer": null,
        "reviewedAt": null,
        "verdict": "PENDING",
        "defectIds": []
      },
      "fidelity": {
        "numericFacts": null,
        "textFactsSha256": null,
        "secondsConversion": "CENTRAL_COMPILER_ONLY"
      },
      "localization": {
        "deKey": null,
        "enKey": null,
        "enStatus": "NOT_STARTED"
      },
      "assetRequirements": []
    },
    {
      "slotId": "battleVariants:004",
      "authorityLabel": "Verstärkungen",
      "authorityId": null,
      "subtype": null,
      "sourceLocator": {
        "file": "inputs/sources/GDD_V5_PHASE10_AUTHORITY_EXTRACT.md",
        "chapter": "17.1",
        "lineStart": 976,
        "lineEnd": 976,
        "lineSha256": "78ebe4d8e8bcc9536963ed0e84a98aa3e862bedc0574a9640cb12c905a97c7c2"
      },
      "runtimeId": null,
      "status": "UNEXTRACTED",
      "extractor": null,
      "extractedAt": null,
      "sourceOutputPath": null,
      "review": {
        "reviewer": null,
        "reviewedAt": null,
        "verdict": "PENDING",
        "defectIds": []
      },
      "fidelity": {
        "numericFacts": null,
        "textFactsSha256": null,
        "secondsConversion": "CENTRAL_COMPILER_ONLY"
      },
      "localization": {
        "deKey": null,
        "enKey": null,
        "enStatus": "NOT_STARTED"
      },
      "assetRequirements": []
    },
    {
      "slotId": "battleVariants:005",
      "authorityLabel": "Anführer",
      "authorityId": null,
      "subtype": null,
      "sourceLocator": {
        "file": "inputs/sources/GDD_V5_PHASE10_AUTHORITY_EXTRACT.md",
        "chapter": "17.1",
        "lineStart": 977,
        "lineEnd": 977,
        "lineSha256": "c89419bc9f8ff90f6ed61ca55cb5775b40b03e3db9bd9048899349a44c8f9bb0"
      },
      "runtimeId": null,
      "status": "UNEXTRACTED",
      "extractor": null,
      "extractedAt": null,
      "sourceOutputPath": null,
      "review": {
        "reviewer": null,
        "reviewedAt": null,
        "verdict": "PENDING",
        "defectIds": []
      },
      "fidelity": {
        "numericFacts": null,
        "textFactsSha256": null,
        "secondsConversion": "CENTRAL_COMPILER_ONLY"
      },
      "localization": {
        "deKey": null,
        "enKey": null,
        "enStatus": "NOT_STARTED"
      },
      "assetRequirements": []
    },
    {
      "slotId": "battleVariants:006",
      "authorityLabel": "Riftsturm",
      "authorityId": null,
      "subtype": null,
      "sourceLocator": {
        "file": "inputs/sources/GDD_V5_PHASE10_AUTHORITY_EXTRACT.md",
        "chapter": "17.1",
        "lineStart": 978,
        "lineEnd": 978,
        "lineSha256": "ceba14fafb951c480038cfa2ce348701e19be26372af1a62aceac0c6eda44843"
      },
      "runtimeId": null,
      "status": "UNEXTRACTED",
      "extractor": null,
      "extractedAt": null,
      "sourceOutputPath": null,
      "review": {
        "reviewer": null,
        "reviewedAt": null,
        "verdict": "PENDING",
        "defectIds": []
      },
      "fidelity": {
        "numericFacts": null,
        "textFactsSha256": null,
        "secondsConversion": "CENTRAL_COMPILER_ONLY"
      },
      "localization": {
        "deKey": null,
        "enKey": null,
        "enStatus": "NOT_STARTED"
      },
      "assetRequirements": []
    },
    {
      "slotId": "battleVariants:007",
      "authorityLabel": "Überleben",
      "authorityId": null,
      "subtype": null,
      "sourceLocator": {
        "file": "inputs/sources/GDD_V5_PHASE10_AUTHORITY_EXTRACT.md",
        "chapter": "17.1",
        "lineStart": 979,
        "lineEnd": 979,
        "lineSha256": "6e5fe8a041bc66c8b45ff38ef56b9ee585bac2c7fa1e43d9909ae17b66de618f"
      },
      "runtimeId": null,
      "status": "UNEXTRACTED",
      "extractor": null,
      "extractedAt": null,
      "sourceOutputPath": null,
      "review": {
        "reviewer": null,
        "reviewedAt": null,
        "verdict": "PENDING",
        "defectIds": []
      },
      "fidelity": {
        "numericFacts": null,
        "textFactsSha256": null,
        "secondsConversion": "CENTRAL_COMPILER_ONLY"
      },
      "localization": {
        "deKey": null,
        "enKey": null,
        "enStatus": "NOT_STARTED"
      },
      "assetRequirements": []
    }
  ]
}
