{
  "schemaVersion": 1,
  "family": "regions",
  "category": "supplementaryAuthoritative",
  "expectedCount": 4,
  "entries": [
    {
      "slotId": "regions:001",
      "authorityLabel": "Aschenstraße",
      "authorityId": null,
      "subtype": null,
      "sourceLocator": {
        "file": "inputs/sources/GDD_V5_PHASE10_AUTHORITY_EXTRACT.md",
        "chapter": "14.1",
        "lineStart": 697,
        "lineEnd": 697,
        "lineSha256": "3024c4283c82260a014383c1769b834b6f37bc76d2fcade214b237960f157223"
      },
      "runtimeId": null,
      "status": "UNEXTRACTED",
      "extractor": null,
      "extractedAt": null,
      "sourceOutputPath": null,
      "review": {
        "reviewer": null,
        "reviewedAt": null,
        "verdict": "PENDING",
        "defectIds": []
      },
      "fidelity": {
        "numericFacts": null,
        "textFactsSha256": null,
        "secondsConversion": "CENTRAL_COMPILER_ONLY"
      },
      "localization": {
        "deKey": null,
        "enKey": null,
        "enStatus": "NOT_STARTED"
      },
      "assetRequirements": []
    },
    {
      "slotId": "regions:002",
      "authorityLabel": "Dornenhain",
      "authorityId": null,
      "subtype": null,
      "sourceLocator": {
        "file": "inputs/sources/GDD_V5_PHASE10_AUTHORITY_EXTRACT.md",
        "chapter": "14.2",
        "lineStart": 712,
        "lineEnd": 712,
        "lineSha256": "54cdd550579f3291bc59d653af5d22586a2acae6566ebe2978173ca10198544c"
      },
      "runtimeId": null,
      "status": "UNEXTRACTED",
      "extractor": null,
      "extractedAt": null,
      "sourceOutputPath": null,
      "review": {
        "reviewer": null,
        "reviewedAt": null,
        "verdict": "PENDING",
        "defectIds": []
      },
      "fidelity": {
        "numericFacts": null,
        "textFactsSha256": null,
        "secondsConversion": "CENTRAL_COMPILER_ONLY"
      },
      "localization": {
        "deKey": null,
        "enKey": null,
        "enStatus": "NOT_STARTED"
      },
      "assetRequirements": []
    },
    {
      "slotId": "regions:003",
      "authorityLabel": "Eisenschmiede",
      "authorityId": null,
      "subtype": null,
      "sourceLocator": {
        "file": "inputs/sources/GDD_V5_PHASE10_AUTHORITY_EXTRACT.md",
        "chapter": "14.3",
        "lineStart": 727,
        "lineEnd": 727,
        "lineSha256": "3b124dafa2328079a4ed0a86ca6a2d25e7b80cb0f42e0566ff4d668dad82cf47"
      },
      "runtimeId": null,
      "status": "UNEXTRACTED",
      "extractor": null,
      "extractedAt": null,
      "sourceOutputPath": null,
      "review": {
        "reviewer": null,
        "reviewedAt": null,
        "verdict": "PENDING",
        "defectIds": []
      },
      "fidelity": {
        "numericFacts": null,
        "textFactsSha256": null,
        "secondsConversion": "CENTRAL_COMPILER_ONLY"
      },
      "localization": {
        "deKey": null,
        "enKey": null,
        "enStatus": "NOT_STARTED"
      },
      "assetRequirements": []
    },
    {
      "slotId": "regions:004",
      "authorityLabel": "Zitadelle der Echos",
      "authorityId": null,
      "subtype": null,
      "sourceLocator": {
        "file": "inputs/sources/GDD_V5_PHASE10_AUTHORITY_EXTRACT.md",
        "chapter": "14.4",
        "lineStart": 742,
        "lineEnd": 742,
        "lineSha256": "b58163b534c52a320b41cb7d7df3ac677d3b8a7c619d7c3abb0e58ef0e94ae6e"
      },
      "runtimeId": null,
      "status": "UNEXTRACTED",
      "extractor": null,
      "extractedAt": null,
      "sourceOutputPath": null,
      "review": {
        "reviewer": null,
        "reviewedAt": null,
        "verdict": "PENDING",
        "defectIds": []
      },
      "fidelity": {
        "numericFacts": null,
        "textFactsSha256": null,
        "secondsConversion": "CENTRAL_COMPILER_ONLY"
      },
      "localization": {
        "deKey": null,
        "enKey": null,
        "enStatus": "NOT_STARTED"
      },
      "assetRequirements": []
    }
  ]
}
