{
  "schemaVersion": 1,
  "family": "bosses",
  "category": "gateCritical",
  "expectedCount": 4,
  "entries": [
    {
      "slotId": "bosses:001",
      "authorityLabel": "Der Aschenkönig - Boss von Akt I",
      "authorityId": null,
      "subtype": null,
      "sourceLocator": {
        "file": "inputs/sources/GDD_V5_PHASE10_AUTHORITY_EXTRACT.md",
        "chapter": "16.1",
        "lineStart": 814,
        "lineEnd": 814,
        "lineSha256": "0f77ad312d89ba4dfca49ac979129f0478a2dc751520bfce019807b8b23cb9f3"
      },
      "runtimeId": null,
      "status": "UNEXTRACTED",
      "extractor": null,
      "extractedAt": null,
      "sourceOutputPath": null,
      "review": {
        "reviewer": null,
        "reviewedAt": null,
        "verdict": "PENDING",
        "defectIds": []
      },
      "fidelity": {
        "numericFacts": null,
        "textFactsSha256": null,
        "secondsConversion": "CENTRAL_COMPILER_ONLY"
      },
      "localization": {
        "deKey": null,
        "enKey": null,
        "enStatus": "NOT_STARTED"
      },
      "assetRequirements": []
    },
    {
      "slotId": "bosses:002",
      "authorityLabel": "Die Dornenmutter - Boss von Akt II",
      "authorityId": null,
      "subtype": null,
      "sourceLocator": {
        "file": "inputs/sources/GDD_V5_PHASE10_AUTHORITY_EXTRACT.md",
        "chapter": "16.2",
        "lineStart": 853,
        "lineEnd": 853,
        "lineSha256": "78ac9e15a81c86c52a44be762ee9b61fd65b0e2da3e56d65cc78fa3fdc278a65"
      },
      "runtimeId": null,
      "status": "UNEXTRACTED",
      "extractor": null,
      "extractedAt": null,
      "sourceOutputPath": null,
      "review": {
        "reviewer": null,
        "reviewedAt": null,
        "verdict": "PENDING",
        "defectIds": []
      },
      "fidelity": {
        "numericFacts": null,
        "textFactsSha256": null,
        "secondsConversion": "CENTRAL_COMPILER_ONLY"
      },
      "localization": {
        "deKey": null,
        "enKey": null,
        "enStatus": "NOT_STARTED"
      },
      "assetRequirements": []
    },
    {
      "slotId": "bosses:003",
      "authorityLabel": "Der Ewige Schmied - Boss von Akt III",
      "authorityId": null,
      "subtype": null,
      "sourceLocator": {
        "file": "inputs/sources/GDD_V5_PHASE10_AUTHORITY_EXTRACT.md",
        "chapter": "16.3",
        "lineStart": 891,
        "lineEnd": 891,
        "lineSha256": "694636aa16cf2dca6220ad73aa52ddb7e958dca4a9f15a8353fde9b91a917ae4"
      },
      "runtimeId": null,
      "status": "UNEXTRACTED",
      "extractor": null,
      "extractedAt": null,
      "sourceOutputPath": null,
      "review": {
        "reviewer": null,
        "reviewedAt": null,
        "verdict": "PENDING",
        "defectIds": []
      },
      "fidelity": {
        "numericFacts": null,
        "textFactsSha256": null,
        "secondsConversion": "CENTRAL_COMPILER_ONLY"
      },
      "localization": {
        "deKey": null,
        "enKey": null,
        "enStatus": "NOT_STARTED"
      },
      "assetRequirements": []
    },
    {
      "slotId": "bosses:004",
      "authorityLabel": "Das Herz des Risses und der Kurator - Endboss von Akt IV",
      "authorityId": null,
      "subtype": null,
      "sourceLocator": {
        "file": "inputs/sources/GDD_V5_PHASE10_AUTHORITY_EXTRACT.md",
        "chapter": "16.4",
        "lineStart": 926,
        "lineEnd": 926,
        "lineSha256": "dfdc3ab67e0eb3855cf404c224c76695542f2d1354b56b81504430988beb4e5c"
      },
      "runtimeId": null,
      "status": "UNEXTRACTED",
      "extractor": null,
      "extractedAt": null,
      "sourceOutputPath": null,
      "review": {
        "reviewer": null,
        "reviewedAt": null,
        "verdict": "PENDING",
        "defectIds": []
      },
      "fidelity": {
        "numericFacts": null,
        "textFactsSha256": null,
        "secondsConversion": "CENTRAL_COMPILER_ONLY"
      },
      "localization": {
        "deKey": null,
        "enKey": null,
        "enStatus": "NOT_STARTED"
      },
      "assetRequirements": []
    }
  ]
}
